{"$schema":"https://json-schema.org/draft/2020-12/schema","additionalProperties":false,"description":"Closed pending-review output for receipt-bound Blizzard patch-note extraction.","properties":{"assertions":{"items":{"type":"object"},"minItems":1,"type":"array"},"document":{"type":"object"},"identity":{"type":"object"},"integrity":{"type":"object"},"schema_version":{"const":"0.1"},"source":{"type":"object"}},"required":["schema_version","identity","source","document","assertions","integrity"],"title":"DpsLab Blizzard patch-note extraction 0.1","type":"object"}
