{"assertions":[{"ability_token":"synthetic_ability","assertion_id":"assertion.1","citation_token":"item.1","new_token":"pct_12","old_token":"pct_10","operation":"change","parameter_family_id":"synthetic.role.damage","subject_tokens":["class.synthetic","spec.synthetic"]}],"document":{"build_token":"120500"},"identity":{"extraction_id":"synthetic.extraction.001","parser_revision":"blizzard.html.0.1","status":"pending_review"},"integrity":{"extraction_sha256":"65656f378062666a50cbe4a6fd1f7823be9c9dd495332af1720fd30df90df7c7","hash_algorithm":"sha256"},"schema_version":"0.1","source":{"byte_count":328,"content_sha256":"6bad233ed1c8d2bab4354519ccfd3bc38452dc69f68175323b678f8a281480b1","receipt_id":"synthetic.receipt.001","receipt_sha256":"6ccf3736a9717ff4f0b367eb770978ea37f967644048ebf76b7493062ad83526"}}
